{
  "schema_version": 1,
  "host_id": "ci-linux-x86",
  "role": "ci",
  "architecture": "x86_64",
  "cpu": {"model": "CI virtual CPU", "physical_cores": 2, "logical_cores": 2, "features": ["avx2", "fma"]},
  "os": {"name": "Linux", "version": "24.04", "kernel": "recorded-by-runner"},
  "toolchains": {"clang": "recorded-by-runner", "rust": "1.98.0", "python": "3.12.14"},
  "source": {"revision": "unknown", "dirty": false}
}
