{"architecture":"aarch64","cpu":{"features":["neon"],"logical_cores":10,"model":"Apple M4","physical_cores":10},"host_id":"apple-m4-primary","os":{"kernel":"24.5.0","name":"Darwin","version":"15.5"},"role":"mac-primary","schema_version":1,"source":{"dirty":false,"revision":"cc838b0b18d8d47c22a0665a81fcb7d12a04629d"},"toolchains":{"clang":"Apple clang version 17.0.0 (clang-1700.0.13.5)","python":"3.12.14","rust":"1.98.0","uv":"0.12.5"}}
